[
  {
    "id": "powers2015_01",
    "name": "SiC theoretical density",
    "symbol": "\\rho_{\\mathrm{SiC}}",
    "value_type": "scalar",
    "value": 2.58,
    "unit": "g/cm³",
    "category": "physical",
    "material": "SiC",
    "source_file": "summaries/2015_Powers_BISON_SiC_Cladding_FuelPerformance.md",
    "confidence": "high",
    "note": "Composition: 70.08 wt% Si, 29.92 wt% C"
  },
  {
    "id": "powers2015_02",
    "name": "Macroscopic thermal neutron absorption cross section",
    "symbol": "\\Sigma_a",
    "value_type": "scalar",
    "value": 0.0021,
    "unit": "cm⁻¹",
    "category": "physical",
    "material": "SiC",
    "temperature": "0.253 eV",
    "source_file": "summaries/2015_Powers_BISON_SiC_Cladding_FuelPerformance.md",
    "confidence": "high",
    "note": "At 0.253 eV; lower than Zircaloy (0.0028 cm⁻¹)"
  },
  {
    "id": "powers2015_03",
    "name": "Cladding thickness (Zircaloy reference)",
    "symbol": "t_{\\mathrm{clad}}",
    "value_type": "scalar",
    "value": 571.5,
    "unit": "μm",
    "category": "simulation",
    "material": "Zircaloy",
    "source_file": "summaries/2015_Powers_BISON_SiC_Cladding_FuelPerformance.md",
    "confidence": "high",
    "note": "Standard PWR cladding thickness used as neutronic reference"
  },
  {
    "id": "powers2015_04",
    "name": "SiC cladding thickness (ATF concept)",
    "symbol": "t_{\\mathrm{SiC}}",
    "value_type": "range",
    "value_min": 571.5,
    "value_max": 900,
    "unit": "μm",
    "category": "simulation",
    "material": "SiC",
    "source_file": "summaries/2015_Powers_BISON_SiC_Cladding_FuelPerformance.md",
    "confidence": "medium",
    "note": "~900 μm required for structural integrity; 571.5 μm uses standard Zircaloy thickness"
  },
  {
    "id": "powers2015_05",
    "name": "U-235 enrichment for SiC cladding (Case II)",
    "symbol": "e^{235}",
    "value_type": "scalar",
    "value": 4.81,
    "unit": "%",
    "category": "simulation",
    "material": "UO₂",
    "source_file": "summaries/2015_Powers_BISON_SiC_Cladding_FuelPerformance.md",
    "confidence": "high",
    "note": "Required to match PWR cycle length with 571.5 μm SiC cladding; lower than Zircaloy case (4.9%)"
  },
  {
    "id": "powers2015_06",
    "name": "Specific power",
    "symbol": "P_{\\mathrm{spec}}",
    "value_type": "scalar",
    "value": 38.33,
    "unit": "MW/tHM",
    "category": "simulation",
    "source_file": "summaries/2015_Powers_BISON_SiC_Cladding_FuelPerformance.md",
    "confidence": "high",
    "note": "PWR operating condition for SiC cladding neutronic assessment"
  },
  {
    "id": "powers2015_07",
    "name": "Discharge burnup",
    "symbol": "BU_{\\mathrm{discharge}}",
    "value_type": "scalar",
    "value": 57.9,
    "unit": "GWd/tHM",
    "category": "irradiation",
    "source_file": "summaries/2015_Powers_BISON_SiC_Cladding_FuelPerformance.md",
    "confidence": "high",
    "note": "1500 EFPD at 38.33 MW/tHM specific power"
  },
  {
    "id": "powers2015_08",
    "name": "Peak compressive stress",
    "symbol": "\\sigma_{\\mathrm{peak}}",
    "value_type": "scalar",
    "value": -24,
    "unit": "MPa",
    "category": "mechanical",
    "material": "SiC",
    "temperature": "600°C",
    "source_file": "summaries/2015_Powers_BISON_SiC_Cladding_FuelPerformance.md",
    "confidence": "medium",
    "note": "Benchmark problem result; radial stress at axial midplane; matches other codes"
  },
  {
    "id": "powers2015_09",
    "name": "High-temperature strength retention limit",
    "symbol": "T_{\\mathrm{strength}}",
    "value_type": "scalar",
    "value": 1400,
    "unit": "°C",
    "category": "mechanical",
    "material": "SiC/SiC",
    "source_file": "summaries/2015_Powers_BISON_SiC_Cladding_FuelPerformance.md",
    "confidence": "high",
    "note": "No strength degradation below this temperature for SiC/SiC composite"
  },
  {
    "id": "powers2015_10",
    "name": "Monolithic SiC layer density (BISON input)",
    "symbol": "\\rho_{\\mathrm{mono}}",
    "value_type": "scalar",
    "value": 3200,
    "unit": "kg/m³",
    "category": "physical",
    "material": "CVD SiC",
    "source_file": "summaries/2015_Powers_BISON_SiC_Cladding_FuelPerformance.md",
    "confidence": "high",
    "note": "From BISON benchmark input file; 3.2 g/cm³, higher than theoretical due to dense CVD"
  },
  {
    "id": "powers2015_11",
    "name": "Composite SiC layer density (BISON input)",
    "symbol": "\\rho_{\\mathrm{comp}}",
    "value_type": "scalar",
    "value": 2000,
    "unit": "kg/m³",
    "category": "physical",
    "material": "SiCf/SiCm composite",
    "source_file": "summaries/2015_Powers_BISON_SiC_Cladding_FuelPerformance.md",
    "confidence": "high",
    "note": "From BISON benchmark input file; 2.0 g/cm³, lower due to porosity"
  },
  {
    "id": "powers2015_12",
    "name": "Benchmark inner surface heat flux",
    "symbol": "q''_{\\mathrm{inner}}",
    "value_type": "scalar",
    "value": 500,
    "unit": "kW/m²",
    "category": "thermal",
    "source_file": "summaries/2015_Powers_BISON_SiC_Cladding_FuelPerformance.md",
    "confidence": "high",
    "note": "Neumann BC on inner clad surface for benchmark problem"
  },
  {
    "id": "powers2015_13",
    "name": "Benchmark outer surface temperature",
    "symbol": "T_{\\mathrm{outer}}",
    "value_type": "scalar",
    "value": 600,
    "unit": "K",
    "category": "thermal",
    "source_file": "summaries/2015_Powers_BISON_SiC_Cladding_FuelPerformance.md",
    "confidence": "high",
    "note": "Dirichlet BC on outer clad surface; initial temperature also 600°C (873 K)"
  },
  {
    "id": "powers2015_14",
    "name": "Coolant pressure",
    "symbol": "P_{\\mathrm{coolant}}",
    "value_type": "scalar",
    "value": 15.0,
    "unit": "MPa",
    "category": "simulation",
    "source_file": "summaries/2015_Powers_BISON_SiC_Cladding_FuelPerformance.md",
    "confidence": "high",
    "note": "Applied to top/bottom of both SiC layers and clad outer surface (1.50e+07 Pa)"
  },
  {
    "id": "powers2015_15",
    "name": "Internal pin pressure",
    "symbol": "P_{\\mathrm{pin}}",
    "value_type": "scalar",
    "value": 5.0,
    "unit": "MPa",
    "category": "simulation",
    "source_file": "summaries/2015_Powers_BISON_SiC_Cladding_FuelPerformance.md",
    "confidence": "high",
    "note": "Applied to inner surface of monolith layer (5.0e+06 Pa)"
  }
]
