[
  {
    "id": "2022_Qian_Dv0",
    "name": "空位扩散预指数因子",
    "symbol": "D_v0",
    "unit": "cm²/s",
    "category": "diffusion",
    "subcategory": "vacancy",
    "source_file": "summaries/2022_Qian_U10Zr_CavitationalVoidSwelling.md",
    "confidence": "high",
    "value_type": "scalar",
    "value": 1e-07,
    "material": "U-10Zr",
    "method": "速率理论模型拟合",
    "note": "通过低温和高温区肿胀实验数据联合标定"
  },
  {
    "id": "2022_Qian_Evm",
    "name": "空位迁移能",
    "symbol": "E_v^m",
    "unit": "eV",
    "category": "diffusion",
    "subcategory": "vacancy",
    "source_file": "summaries/2022_Qian_U10Zr_CavitationalVoidSwelling.md",
    "confidence": "high",
    "value_type": "scalar",
    "value": 0.34,
    "material": "U-10Zr",
    "method": "DFT计算（VASP），与Huang & Wirth 2011一致",
    "note": "远低于Rest (1993)所用值，是本文核心改进参数"
  },
  {
    "id": "2022_Qian_Evf",
    "name": "空位形成能",
    "symbol": "E_v^f",
    "unit": "eV",
    "category": "diffusion",
    "subcategory": "vacancy",
    "source_file": "summaries/2022_Qian_U10Zr_CavitationalVoidSwelling.md",
    "confidence": "high",
    "value_type": "scalar",
    "value": 1.77,
    "material": "U-10Zr",
    "method": "DFT计算（VASP，5×2×3超胞）"
  },
  {
    "id": "2022_Qian_Di0",
    "name": "间隙原子扩散预指数因子",
    "symbol": "D_i0",
    "unit": "cm²/s",
    "category": "diffusion",
    "subcategory": "interstitial",
    "source_file": "summaries/2022_Qian_U10Zr_CavitationalVoidSwelling.md",
    "confidence": "medium",
    "value_type": "scalar",
    "value": 0.0001,
    "material": "U-10Zr",
    "method": "速率理论模型拟合"
  },
  {
    "id": "2022_Qian_Eim",
    "name": "间隙原子迁移能",
    "symbol": "E_i^m",
    "unit": "eV",
    "category": "diffusion",
    "subcategory": "interstitial",
    "source_file": "summaries/2022_Qian_U10Zr_CavitationalVoidSwelling.md",
    "confidence": "high",
    "value_type": "scalar",
    "value": 0.19,
    "material": "U-10Zr",
    "method": "DFT计算，引自Huang & Wirth 2011"
  },
  {
    "id": "2022_Qian_Dfg0",
    "name": "裂变气体原子扩散预指数因子",
    "symbol": "D_fg0",
    "unit": "cm²/s",
    "category": "diffusion",
    "subcategory": "fission_gas",
    "source_file": "summaries/2022_Qian_U10Zr_CavitationalVoidSwelling.md",
    "confidence": "high",
    "value_type": "scalar",
    "value": 0.0012,
    "material": "U-10Zr",
    "method": "引自Ogata et al. 1996"
  },
  {
    "id": "2022_Qian_Efgm",
    "name": "裂变气体原子扩散迁移能",
    "symbol": "E_fg^m",
    "unit": "eV",
    "category": "diffusion",
    "subcategory": "fission_gas",
    "source_file": "summaries/2022_Qian_U10Zr_CavitationalVoidSwelling.md",
    "confidence": "high",
    "value_type": "scalar",
    "value": 1.16,
    "material": "U-10Zr",
    "method": "引自Ogata et al. 1996"
  },
  {
    "id": "2022_Qian_rho_d",
    "name": "位错密度",
    "symbol": "ρ_d",
    "unit": "cm⁻²",
    "category": "microstructure",
    "source_file": "summaries/2022_Qian_U10Zr_CavitationalVoidSwelling.md",
    "confidence": "medium",
    "value_type": "scalar",
    "value": 7000000000.0,
    "material": "U-10Zr",
    "method": "引自Rest 1993"
  },
  {
    "id": "2022_Qian_cavity_diameter",
    "name": "空穴平均直径",
    "symbol": "d_cav",
    "unit": "μm",
    "category": "microstructure",
    "subcategory": "cavity",
    "source_file": "summaries/2022_Qian_U10Zr_CavitationalVoidSwelling.md",
    "confidence": "high",
    "value_type": "scalar",
    "value": 2.98,
    "temperature": "450-560",
    "material": "U-10Zr",
    "method": "金相测量（1328个空穴统计），标准差0.988 μm",
    "note": "低温区辐照后测量"
  },
  {
    "id": "2022_Qian_cavity_density",
    "name": "空穴数密度",
    "symbol": "N_cav",
    "unit": "cm⁻³",
    "category": "microstructure",
    "subcategory": "cavity",
    "source_file": "summaries/2022_Qian_U10Zr_CavitationalVoidSwelling.md",
    "confidence": "high",
    "value_type": "scalar",
    "value": 8000000000.0,
    "temperature": "450-560",
    "material": "U-10Zr",
    "method": "金相测量",
    "note": "低温区辐照后测量"
  },
  {
    "id": "2022_Qian_hydrostatic_stress",
    "name": "静水应力（压）",
    "symbol": "σ_h",
    "unit": "MPa",
    "category": "mechanical",
    "source_file": "summaries/2022_Qian_U10Zr_CavitationalVoidSwelling.md",
    "confidence": "high",
    "value_type": "range",
    "value_min": 60,
    "value_max": 130,
    "temperature": "450-560",
    "material": "U-10Zr",
    "method": "COMSOL有限元热力学分析"
  },
  {
    "id": "2022_Qian_surface_energy",
    "name": "U-10Zr表面能",
    "symbol": "γ",
    "unit": "J/m²",
    "category": "surface_energy",
    "source_file": "summaries/2022_Qian_U10Zr_CavitationalVoidSwelling.md",
    "confidence": "medium",
    "value_type": "scalar",
    "value": 0.5,
    "material": "U-10Zr",
    "method": "引自Rest 1993"
  },
  {
    "id": "2022_Qian_nucleation_bulk",
    "name": "体内气泡形核因子",
    "symbol": "f_nuc_bulk",
    "unit": "dimensionless",
    "category": "bubble",
    "source_file": "summaries/2022_Qian_U10Zr_CavitationalVoidSwelling.md",
    "confidence": "medium",
    "value_type": "scalar",
    "value": 1e-05,
    "material": "U-10Zr",
    "method": "引自Rest 1993"
  },
  {
    "id": "2022_Qian_grain_size",
    "name": "晶粒尺寸",
    "symbol": "d_grain",
    "unit": "cm",
    "category": "microstructure",
    "source_file": "summaries/2022_Qian_U10Zr_CavitationalVoidSwelling.md",
    "confidence": "medium",
    "value_type": "scalar",
    "value": 0.001,
    "material": "U-10Zr",
    "method": "TEM粗略估计"
  },
  {
    "id": "2022_Qian_phase_boundary_T",
    "name": "α/γ相界温度",
    "symbol": "T_αγ",
    "unit": "K",
    "category": "phase_transformation",
    "source_file": "summaries/2022_Qian_U10Zr_CavitationalVoidSwelling.md",
    "confidence": "high",
    "value_type": "scalar",
    "value": 903,
    "material": "U-10Zr",
    "method": "高温区建模用相界温度"
  },
  {
    "id": "2022_Qian_fission_yield",
    "name": "裂变气体产额",
    "symbol": "y_fg",
    "unit": "dimensionless",
    "category": "irradiation",
    "source_file": "summaries/2022_Qian_U10Zr_CavitationalVoidSwelling.md",
    "confidence": "high",
    "value_type": "scalar",
    "value": 0.25,
    "material": "U-10Zr",
    "note": "每次裂变产生的裂变气体原子数"
  },
  {
    "id": "2022_Qian_swell_lowT",
    "name": "低温区体积肿胀",
    "symbol": "ΔV/V",
    "unit": "%",
    "category": "irradiation",
    "subcategory": "swelling",
    "source_file": "summaries/2022_Qian_U10Zr_CavitationalVoidSwelling.md",
    "confidence": "high",
    "value_type": "scalar",
    "value": 12,
    "value_min": null,
    "value_max": null,
    "temperature": "450-560",
    "material": "U-10Zr",
    "method": "冷中子射线照相与金相测量",
    "note": "在0.55 at.%燃耗下"
  }
]