[
  {
    "id": "hu2017_int_diffusivity_ratio",
    "name": "间隙原子与Xe扩散系数比",
    "symbol": "D_{\\text{int}} / D_{\\text{Xe}}",
    "value_type": "scalar",
    "value": 1e5,
    "unit": "无量纲",
    "category": "diffusion",
    "source_file": "summaries/2017_Hu_RateTheory_PhaseField_Recrystallization_UMo.md",
    "confidence": "high",
    "material": "UMo (bcc)",
    "note": "间隙原子扩散系数比Xe高约5个数量级；文中明确设定 D*_int = 1.0×10^5 用于2D模拟"
  },
  {
    "id": "hu2017_int_diffusivity_normalized",
    "name": "归一化间隙原子扩散系数",
    "symbol": "D^*_{\\text{int}}",
    "value_type": "scalar",
    "value": 1e5,
    "unit": "无量纲 (归一化)",
    "category": "diffusion",
    "source_file": "summaries/2017_Hu_RateTheory_PhaseField_Recrystallization_UMo.md",
    "confidence": "high",
    "material": "UMo (bcc)",
    "note": "2D多晶模拟中间隙原子沿⟨101⟩方向扩散的归一化扩散系数"
  },
  {
    "id": "hu2017_fission_rate",
    "name": "裂变率",
    "symbol": "\\dot{F}",
    "value_type": "range",
    "value_min": 2.4e20,
    "value_max": 8.2e20,
    "unit": "fissions/m³/s",
    "category": "irradiation",
    "source_file": "summaries/2017_Hu_RateTheory_PhaseField_Recrystallization_UMo.md",
    "confidence": "high",
    "material": "UMo",
    "note": "实验裂变率范围 2.4–6.8×10²⁰ fissions/m³/s；2D模拟采用 8.2×10²⁰ fissions/m³/s"
  },
  {
    "id": "hu2017_fission_density_sim",
    "name": "模拟裂变密度范围",
    "symbol": "F_D",
    "value_type": "range",
    "value_min": 1.87e26,
    "value_max": 7.5e27,
    "unit": "fissions/m³",
    "category": "irradiation",
    "source_file": "summaries/2017_Hu_RateTheory_PhaseField_Recrystallization_UMo.md",
    "confidence": "high",
    "material": "UMo",
    "note": "2D多晶模拟中使用的裂变密度范围，对应图2快照"
  },
  {
    "id": "hu2017_gas_atom_volume_ratio",
    "name": "气体原子体积与空位体积比",
    "symbol": "\\gamma_0",
    "value_type": "scalar",
    "value": 2.0,
    "unit": "无量纲",
    "category": "thermodynamic",
    "source_file": "summaries/2017_Hu_RateTheory_PhaseField_Recrystallization_UMo.md",
    "confidence": "high",
    "material": "UMo",
    "note": "一个Xe原子占据两个空位位点的假设下，γ₀ = 2.0"
  },
  {
    "id": "hu2017_avrami_k_formula",
    "name": "修正Avrami方程反应常数k",
    "symbol": "k",
    "value_type": "expression",
    "expression": "0.1 \\times [0.75(10 - c_{\\text{Mo}}) + 1]",
    "unit": "无量纲",
    "category": "phase_transformation",
    "source_file": "summaries/2017_Hu_RateTheory_PhaseField_Recrystallization_UMo.md",
    "confidence": "medium",
    "material": "UMo",
    "method": "empirical",
    "note": "Kim et al. 经验公式，c_Mo 为Mo含量(wt.%)"
  },
  {
    "id": "hu2017_avrami_FD0",
    "name": "再结晶起始临界裂变密度",
    "symbol": "F_{D0}",
    "value_type": "scalar",
    "value": 1.67,
    "unit": "10²⁷ fissions/m³",
    "category": "irradiation",
    "source_file": "summaries/2017_Hu_RateTheory_PhaseField_Recrystallization_UMo.md",
    "confidence": "medium",
    "material": "UMo (atomized powder fuel)",
    "method": "empirical",
    "note": "雾化粉末燃料的再结晶孕育裂变密度，来自Kim et al. 经验公式"
  },
  {
    "id": "hu2017_avrami_n",
    "name": "Avrami指数",
    "symbol": "n",
    "value_type": "scalar",
    "value": 2.6,
    "unit": "无量纲",
    "category": "phase_transformation",
    "source_file": "summaries/2017_Hu_RateTheory_PhaseField_Recrystallization_UMo.md",
    "confidence": "medium",
    "material": "UMo",
    "method": "empirical",
    "note": "Avrami指数强烈依赖于晶粒尺寸"
  },
  {
    "id": "hu2017_grain_size_sim_1D",
    "name": "1D双晶模拟晶粒尺寸范围",
    "symbol": "nx l_0 / 2",
    "value_type": "list",
    "values": [128, 256, 512, 1024, 2048, 4096],
    "unit": "网格点数 (nx)",
    "category": "microstructure",
    "source_file": "summaries/2017_Hu_RateTheory_PhaseField_Recrystallization_UMo.md",
    "confidence": "high",
    "note": "1D双晶模拟中nx取值用于研究晶粒尺寸效应"
  },
  {
    "id": "hu2017_grain_size_2D",
    "name": "2D多晶模拟平均晶粒直径",
    "symbol": "D",
    "value_type": "list",
    "values": [1.34, 4.36, 8.72],
    "unit": "μm",
    "category": "microstructure",
    "source_file": "summaries/2017_Hu_RateTheory_PhaseField_Recrystallization_UMo.md",
    "confidence": "high",
    "material": "UMo",
    "note": "2D多晶模拟中三种平均晶粒直径"
  },
  {
    "id": "hu2017_rx_grain_size",
    "name": "再结晶晶粒半径",
    "symbol": "R_{\\text{rx}}",
    "value_type": "scalar",
    "value": 0.3,
    "unit": "μm (推测)",
    "category": "microstructure",
    "source_file": "summaries/2017_Hu_RateTheory_PhaseField_Recrystallization_UMo.md",
    "confidence": "low",
    "material": "UMo",
    "note": "文中假设再结晶晶粒具有均匀半径R_rx，具体数值在补充材料中"
  },
  {
    "id": "hu2017_free_energy_coefficient",
    "name": "自由能密度展开系数",
    "symbol": "a_3",
    "value_type": "scalar",
    "value": 0.2,
    "unit": "无量纲",
    "category": "thermodynamic",
    "source_file": "summaries/2017_Hu_RateTheory_PhaseField_Recrystallization_UMo.md",
    "confidence": "high",
    "note": "自由能密度函数 f = 4η²(1-η)² - ρ̄₀(η² - η + 0.2η³) 中的三次项系数"
  },
  {
    "id": "hu2017_rho_crit_transition_width",
    "name": "临界间隙环密度归一化过渡宽度参数",
    "symbol": "\\Delta F_D / F_{D,\\text{crit}}",
    "value_type": "scalar",
    "value": 0.7,
    "unit": "无量纲",
    "category": "phase_transformation",
    "source_file": "summaries/2017_Hu_RateTheory_PhaseField_Recrystallization_UMo.md",
    "confidence": "high",
    "note": "归一化间隙环密度公式 ρ̄₀ = 0.3/(exp(-20(ρ_loop/ρ_crit - 0.7)) + 1.0) 中的过渡宽度参数"
  },
  {
    "id": "hu2017_rho_crit_transition_scale",
    "name": "临界间隙环密度归一化过渡陡度参数",
    "symbol": "\\alpha",
    "value_type": "scalar",
    "value": 20,
    "unit": "无量纲",
    "category": "phase_transformation",
    "source_file": "summaries/2017_Hu_RateTheory_PhaseField_Recrystallization_UMo.md",
    "confidence": "high",
    "note": "归一化间隙环密度 sigmoid 函数中的陡度参数"
  },
  {
    "id": "hu2017_rho_bar0_amplitude",
    "name": "归一化间隙环密度幅值",
    "symbol": "\\bar{\\rho}_0^{\\max}",
    "value_type": "scalar",
    "value": 0.3,
    "unit": "无量纲",
    "category": "microstructure",
    "source_file": "summaries/2017_Hu_RateTheory_PhaseField_Recrystallization_UMo.md",
    "confidence": "high",
    "note": "ρ̄₀ = 0.3/(exp(-20(ρ_loop/ρ_crit - 0.7)) + 1.0) 中的最大值"
  },
  {
    "id": "hu2017_grain_size_exp_avg",
    "name": "实验样品平均晶粒尺寸",
    "symbol": "D_{\\text{exp}}",
    "value_type": "range",
    "value_min": 4,
    "value_max": 5,
    "unit": "μm",
    "category": "microstructure",
    "source_file": "summaries/2017_Hu_RateTheory_PhaseField_Recrystallization_UMo.md",
    "confidence": "medium",
    "material": "UMo",
    "note": "实验样品平均晶粒尺寸约4–5 μm，模拟中3.2–6.4 μm的结果与实验吻合"
  },
  {
    "id": "hu2017_sim_rx_grain_sizes",
    "name": "模拟再结晶动力学晶粒尺寸",
    "symbol": "D_{\\text{sim}}",
    "value_type": "list",
    "values": [1.34, 3.20, 4.36, 6.40],
    "unit": "μm",
    "category": "microstructure",
    "source_file": "summaries/2017_Hu_RateTheory_PhaseField_Recrystallization_UMo.md",
    "confidence": "high",
    "material": "UMo",
    "note": "1D和2D模拟中用于对比再结晶动力学的晶粒尺寸"
  },
  {
    "id": "hu2017_bubble_snapshot_FD",
    "name": "气泡密度分布快照裂变密度",
    "symbol": "F_D",
    "value_type": "list",
    "values": [1.87e26, 7.5e26, 2.25e27, 3.01e27, 5.05e27, 7.5e27],
    "unit": "fissions/m³",
    "category": "irradiation",
    "source_file": "summaries/2017_Hu_RateTheory_PhaseField_Recrystallization_UMo.md",
    "confidence": "high",
    "material": "UMo",
    "note": "图2中气泡密度分布快照对应的裂变密度"
  },
  {
    "id": "hu2017_int_migration_direction",
    "name": "间隙原子迁移方向",
    "symbol": "\\langle 110 \\rangle",
    "value_type": "scalar",
    "value": "[110] dumbbell, ⟨110⟩ migration",
    "unit": "晶向",
    "category": "diffusion",
    "source_file": "summaries/2017_Hu_RateTheory_PhaseField_Recrystallization_UMo.md",
    "confidence": "high",
    "material": "UMo (bcc)",
    "note": "DFT计算和MD模拟表明间隙原子以[110]哑铃构型沿⟨110⟩方向迁移"
  }
]
