[
  {
    "id": "georgesco2025_01",
    "name": "Uranium interstitial migration energy",
    "symbol": "E_m^{\\mathrm{UI}}",
    "value_type": "scalar",
    "value": 2.55,
    "unit": "eV",
    "category": "diffusion",
    "material": "UO2",
    "method": "RT model fitting",
    "note": "Fitted from Xe and Au irradiation data at 93, 298, 873 K",
    "source_file": "summaries/2025_Georgesco_RateTheory_UO2_ElectronicEnergyLoss.md",
    "confidence": "high"
  },
  {
    "id": "georgesco2025_02",
    "name": "Oxygen interstitial migration energy",
    "symbol": "E_m^{\\mathrm{OI}}",
    "value_type": "scalar",
    "value": 0.825,
    "unit": "eV",
    "category": "diffusion",
    "material": "UO2",
    "method": "RT model fitting",
    "note": "Fastest diffusing single defect; fitted from Xe/Au data",
    "source_file": "summaries/2025_Georgesco_RateTheory_UO2_ElectronicEnergyLoss.md",
    "confidence": "high"
  },
  {
    "id": "georgesco2025_03",
    "name": "Oxygen vacancy migration energy",
    "symbol": "E_m^{\\mathrm{VO}}",
    "value_type": "scalar",
    "value": 1.6,
    "unit": "eV",
    "category": "diffusion",
    "material": "UO2",
    "method": "RT model fitting",
    "source_file": "summaries/2025_Georgesco_RateTheory_UO2_ElectronicEnergyLoss.md",
    "confidence": "high"
  },
  {
    "id": "georgesco2025_04",
    "name": "Uranium vacancy migration energy",
    "symbol": "E_m^{\\mathrm{VU}}",
    "value_type": "scalar",
    "value": 3.9,
    "unit": "eV",
    "category": "diffusion",
    "material": "UO2",
    "method": "set (not fitted)",
    "note": "Very low mobility; set based on literature",
    "source_file": "summaries/2025_Georgesco_RateTheory_UO2_ElectronicEnergyLoss.md",
    "confidence": "medium"
  },
  {
    "id": "georgesco2025_05",
    "name": "Uranium interstitial diffusion pre-factor",
    "symbol": "D_0^{\\mathrm{UI}}",
    "value_type": "scalar",
    "value": 0.01,
    "unit": "cm²/s",
    "category": "diffusion",
    "material": "UO2",
    "method": "literature",
    "source_file": "summaries/2025_Georgesco_RateTheory_UO2_ElectronicEnergyLoss.md",
    "confidence": "medium"
  },
  {
    "id": "georgesco2025_06",
    "name": "Oxygen interstitial diffusion pre-factor",
    "symbol": "D_0^{\\mathrm{OI}}",
    "value_type": "scalar",
    "value": 0.01,
    "unit": "cm²/s",
    "category": "diffusion",
    "material": "UO2",
    "method": "literature",
    "source_file": "summaries/2025_Georgesco_RateTheory_UO2_ElectronicEnergyLoss.md",
    "confidence": "medium"
  },
  {
    "id": "georgesco2025_07",
    "name": "Oxygen vacancy diffusion pre-factor",
    "symbol": "D_0^{\\mathrm{VO}}",
    "value_type": "scalar",
    "value": 0.02,
    "unit": "cm²/s",
    "category": "diffusion",
    "material": "UO2",
    "method": "literature",
    "source_file": "summaries/2025_Georgesco_RateTheory_UO2_ElectronicEnergyLoss.md",
    "confidence": "medium"
  },
  {
    "id": "georgesco2025_08",
    "name": "Uranium vacancy diffusion pre-factor",
    "symbol": "D_0^{\\mathrm{VU}}",
    "value_type": "scalar",
    "value": 0.65,
    "unit": "cm²/s",
    "category": "diffusion",
    "material": "UO2",
    "method": "literature",
    "source_file": "summaries/2025_Georgesco_RateTheory_UO2_ElectronicEnergyLoss.md",
    "confidence": "medium"
  },
  {
    "id": "georgesco2025_09",
    "name": "Athermal diffusion coefficient",
    "symbol": "D_{\\mathrm{ath}}",
    "value_type": "scalar",
    "value": 7.5e-23,
    "unit": "cm²/s",
    "category": "diffusion",
    "material": "UO2",
    "method": "RT model fitting (single Si irradiation)",
    "note": "Applied to all mobile defects for single 6 MeV Si irradiation; accounts for electronic excitations/ionizations",
    "source_file": "summaries/2025_Georgesco_RateTheory_UO2_ElectronicEnergyLoss.md",
    "confidence": "high"
  },
  {
    "id": "georgesco2025_10",
    "name": "In-cascade loop nucleation parameter",
    "symbol": "\\varepsilon",
    "value_type": "scalar",
    "value": 20,
    "unit": "dimensionless",
    "category": "irradiation",
    "material": "UO2",
    "method": "RT model fitting",
    "note": "Number of loops created directly within collision cascade; fitted from Xe/Au data",
    "source_file": "summaries/2025_Georgesco_RateTheory_UO2_ElectronicEnergyLoss.md",
    "confidence": "high"
  },
  {
    "id": "georgesco2025_11",
    "name": "Loop disappearance pre-factor",
    "symbol": "\\tau_0",
    "value_type": "scalar",
    "value": 5.5e-7,
    "unit": "cm/s",
    "category": "microstructure",
    "material": "UO2",
    "method": "RT model fitting",
    "source_file": "summaries/2025_Georgesco_RateTheory_UO2_ElectronicEnergyLoss.md",
    "confidence": "high"
  },
  {
    "id": "georgesco2025_12",
    "name": "Loop disappearance activation energy",
    "symbol": "E_a^{\\mathrm{loop}}",
    "value_type": "scalar",
    "value": 2.8,
    "unit": "eV",
    "category": "microstructure",
    "material": "UO2",
    "method": "RT model fitting",
    "note": "Temperature-dependent loop disappearance follows Arrhenius law τ = τ₀·exp(-Ea/kBT)",
    "source_file": "summaries/2025_Georgesco_RateTheory_UO2_ElectronicEnergyLoss.md",
    "confidence": "high"
  },
  {
    "id": "georgesco2025_13",
    "name": "Effective temperature shift for dual-beam irradiation",
    "symbol": "\\Delta T_{\\mathrm{dual}}",
    "value_type": "scalar",
    "value": 615,
    "unit": "K",
    "category": "irradiation",
    "material": "UO2",
    "method": "RT model fitting (dual Xe+Si irradiation)",
    "note": "Best agreement for dual 0.39 MeV Xe + 6 MeV Si irradiation; accounts for thermal spike local heating by Si ions",
    "source_file": "summaries/2025_Georgesco_RateTheory_UO2_ElectronicEnergyLoss.md",
    "confidence": "medium"
  },
  {
    "id": "georgesco2025_14",
    "name": "Uranium threshold displacement energy",
    "symbol": "E_d^{\\mathrm{U}}",
    "value_type": "scalar",
    "value": 40,
    "unit": "eV",
    "category": "irradiation",
    "material": "UO2",
    "method": "literature (Iradina code input)",
    "source_file": "summaries/2025_Georgesco_RateTheory_UO2_ElectronicEnergyLoss.md",
    "confidence": "medium"
  },
  {
    "id": "georgesco2025_15",
    "name": "Oxygen threshold displacement energy",
    "symbol": "E_d^{\\mathrm{O}}",
    "value_type": "scalar",
    "value": 20,
    "unit": "eV",
    "category": "irradiation",
    "material": "UO2",
    "method": "literature (Iradina code input)",
    "source_file": "summaries/2025_Georgesco_RateTheory_UO2_ElectronicEnergyLoss.md",
    "confidence": "medium"
  },
  {
    "id": "georgesco2025_16",
    "name": "Initial loop radius for Xe irradiation",
    "symbol": "R_{L,0}^{\\mathrm{Xe}}",
    "value_type": "scalar",
    "value": 2.0,
    "unit": "nm",
    "category": "microstructure",
    "material": "UO2",
    "method": "TEM observation",
    "note": "Smallest observable loop size for 0.39 MeV Xe irradiation",
    "source_file": "summaries/2025_Georgesco_RateTheory_UO2_ElectronicEnergyLoss.md",
    "confidence": "medium"
  },
  {
    "id": "georgesco2025_17",
    "name": "Initial loop radius for Au irradiation",
    "symbol": "R_{L,0}^{\\mathrm{Au}}",
    "value_type": "scalar",
    "value": 3.3,
    "unit": "nm",
    "category": "microstructure",
    "material": "UO2",
    "method": "TEM observation",
    "note": "Smallest observable loop size for 4 MeV Au irradiation",
    "source_file": "summaries/2025_Georgesco_RateTheory_UO2_ElectronicEnergyLoss.md",
    "confidence": "medium"
  },
  {
    "id": "georgesco2025_18",
    "name": "DOi at 873 K",
    "symbol": "D_{\\mathrm{OI}}(873\\,\\mathrm{K})",
    "value_type": "scalar",
    "value": 1.7e-7,
    "unit": "cm²/s",
    "category": "diffusion",
    "material": "UO2",
    "temperature": "873 K",
    "method": "calculated from Arrhenius law",
    "source_file": "summaries/2025_Georgesco_RateTheory_UO2_ElectronicEnergyLoss.md",
    "confidence": "high"
  },
  {
    "id": "georgesco2025_19",
    "name": "DUi at 873 K",
    "symbol": "D_{\\mathrm{UI}}(873\\,\\mathrm{K})",
    "value_type": "scalar",
    "value": 1.9e-17,
    "unit": "cm²/s",
    "category": "diffusion",
    "material": "UO2",
    "temperature": "873 K",
    "method": "calculated from Arrhenius law",
    "source_file": "summaries/2025_Georgesco_RateTheory_UO2_ElectronicEnergyLoss.md",
    "confidence": "high"
  },
  {
    "id": "georgesco2025_20",
    "name": "Irradiation conditions",
    "symbol": "N/A",
    "value_type": "list",
    "value": [
      {"ion": "Xe3+", "energy_MeV": 0.39, "T_K": [93, 298, 873], "elec_keV_nm": 0.4, "nucl_keV_nm": 2.9},
      {"ion": "Au2+", "energy_MeV": 4, "T_K": [93, 298, 873], "elec_keV_nm": 2.9, "nucl_keV_nm": 4.9},
      {"ion": "Si3+", "energy_MeV": 6, "T_K": [93, 298], "elec_keV_nm": 5.4, "nucl_keV_nm": 0.04}
    ],
    "unit": "mixed",
    "category": "irradiation",
    "material": "UO2",
    "method": "Iradina code calculation + experiment",
    "note": "All irradiations at JANNuS-Orsay; energies averaged over 100 nm foil thickness",
    "source_file": "summaries/2025_Georgesco_RateTheory_UO2_ElectronicEnergyLoss.md",
    "confidence": "high"
  }
]
