[
  {
    "id": "AAG25-a0",
    "name": "Lattice constant of Mo",
    "symbol": "a_0",
    "unit": "nm",
    "category": "crystal_structure",
    "source_file": "summaries/2025_Aagesen_PhaseTransformation_Superlattice.md",
    "confidence": "high",
    "value_type": "scalar",
    "value": 0.315,
    "material": "Mo (BCC)",
    "method": "literature"
  },
  {
    "id": "AAG25-E0i",
    "name": "SIA migration activation energy",
    "symbol": "E_0^i",
    "unit": "eV",
    "category": "diffusion",
    "source_file": "summaries/2025_Aagesen_PhaseTransformation_Superlattice.md",
    "confidence": "high",
    "value_type": "scalar",
    "value": 0.05,
    "material": "Mo (BCC)",
    "method": "AKMC parameterization"
  },
  {
    "id": "AAG25-E0v",
    "name": "Vacancy migration activation energy",
    "symbol": "E_0^v",
    "unit": "eV",
    "category": "diffusion",
    "source_file": "summaries/2025_Aagesen_PhaseTransformation_Superlattice.md",
    "confidence": "high",
    "value_type": "scalar",
    "value": 1.495,
    "material": "Mo (BCC)",
    "method": "AKMC parameterization"
  },
  {
    "id": "AAG25-Emix",
    "name": "Enthalpy of mixing (regular solution parameter)",
    "symbol": "E_mix",
    "unit": "eV",
    "category": "thermodynamic",
    "source_file": "summaries/2025_Aagesen_PhaseTransformation_Superlattice.md",
    "confidence": "high",
    "value_type": "scalar",
    "value": 3.0,
    "material": "Mo (BCC)",
    "method": "AKMC parameterization",
    "note": "Equals vacancy formation energy E_f^v; used as regular solution parameter omega"
  },
  {
    "id": "AAG25-kappa",
    "name": "Gradient energy coefficient",
    "symbol": "κ",
    "unit": "eV/nm",
    "category": "thermodynamic",
    "source_file": "summaries/2025_Aagesen_PhaseTransformation_Superlattice.md",
    "confidence": "high",
    "value_type": "scalar",
    "value": 2.41,
    "material": "Mo (BCC)",
    "method": "AKMC parameterization"
  },
  {
    "id": "AAG25-nu0",
    "name": "Attempt frequency",
    "symbol": "ν_0",
    "unit": "s⁻¹",
    "category": "diffusion",
    "source_file": "summaries/2025_Aagesen_PhaseTransformation_Superlattice.md",
    "confidence": "high",
    "value_type": "scalar",
    "value": 1000000000000.0,
    "material": "Mo (BCC)",
    "method": "standard value"
  },
  {
    "id": "AAG25-Riv",
    "name": "Vacancy-interstitial recombination distance",
    "symbol": "R_iv",
    "unit": "nm",
    "category": "irradiation",
    "source_file": "summaries/2025_Aagesen_PhaseTransformation_Superlattice.md",
    "confidence": "high",
    "value_type": "scalar",
    "value": 0.445,
    "material": "Mo (BCC)",
    "note": "3NN distance = √2 · a_0",
    "method": "AKMC parameterization"
  },
  {
    "id": "AAG25-Ns",
    "name": "Sink absorption threshold (number of jumps)",
    "symbol": "N_s",
    "unit": "dimensionless",
    "category": "irradiation",
    "source_file": "summaries/2025_Aagesen_PhaseTransformation_Superlattice.md",
    "confidence": "high",
    "value_type": "scalar",
    "value": 1000,
    "material": "Mo (BCC)",
    "note": "Corresponds to sink strength k_s = 8.06×10¹⁶ m⁻²"
  },
  {
    "id": "AAG25-ks",
    "name": "Sink strength",
    "symbol": "k_s",
    "unit": "m⁻²",
    "category": "irradiation",
    "source_file": "summaries/2025_Aagesen_PhaseTransformation_Superlattice.md",
    "confidence": "high",
    "value_type": "scalar",
    "value": 8.06e+16,
    "material": "Mo (BCC)",
    "method": "calculated from N_s and jump distance"
  },
  {
    "id": "AAG25-D0",
    "name": "Pre-exponential diffusion coefficient",
    "symbol": "D_i^0 = D_v^0",
    "unit": "m²/s",
    "category": "diffusion",
    "source_file": "summaries/2025_Aagesen_PhaseTransformation_Superlattice.md",
    "confidence": "high",
    "value_type": "scalar",
    "value": 7.44e-08,
    "material": "Mo (BCC)",
    "note": "D⁰ = (3/4)a₀²ν₀",
    "method": "calculated"
  },
  {
    "id": "AAG25-lambda-773",
    "name": "Superlattice spacing at 773 K",
    "symbol": "λ",
    "unit": "nm",
    "category": "microstructure",
    "source_file": "summaries/2025_Aagesen_PhaseTransformation_Superlattice.md",
    "confidence": "high",
    "value_type": "scalar",
    "value": 3.15,
    "temperature": "773 K",
    "material": "Mo (BCC)",
    "method": "AKMC simulation, P=10⁻² dpa/s, nucleation & growth"
  },
  {
    "id": "AAG25-lambda-973",
    "name": "Superlattice spacing at 973 K",
    "symbol": "λ",
    "unit": "nm",
    "category": "microstructure",
    "source_file": "summaries/2025_Aagesen_PhaseTransformation_Superlattice.md",
    "confidence": "high",
    "value_type": "scalar",
    "value": 5.04,
    "temperature": "973 K",
    "material": "Mo (BCC)",
    "method": "AKMC simulation, P=10⁻² dpa/s, nucleation & growth"
  },
  {
    "id": "AAG25-Ptrans-773",
    "name": "Dose rate for nucleation→spinodal transition at 773 K",
    "symbol": "P_transition",
    "unit": "dpa/s",
    "category": "phase_transformation",
    "source_file": "summaries/2025_Aagesen_PhaseTransformation_Superlattice.md",
    "confidence": "medium",
    "value_type": "scalar",
    "value": 0.6,
    "temperature": "773 K",
    "material": "Mo (BCC)",
    "method": "rate theory analytical model",
    "note": "AKMC shows transition between 0.1 and 1 dpa/s"
  },
  {
    "id": "AAG25-Ptrans-873",
    "name": "Dose rate for nucleation→spinodal transition at 873 K",
    "symbol": "P_transition",
    "unit": "dpa/s",
    "category": "phase_transformation",
    "source_file": "summaries/2025_Aagesen_PhaseTransformation_Superlattice.md",
    "confidence": "medium",
    "value_type": "scalar",
    "value": 11.0,
    "temperature": "873 K",
    "material": "Mo (BCC)",
    "method": "rate theory analytical model",
    "note": "AKMC shows transition between 1 and 5 dpa/s"
  },
  {
    "id": "AAG25-Ptrans-1173",
    "name": "Dose rate for nucleation→spinodal transition at 1173 K (experiment comparison)",
    "symbol": "P_transition",
    "unit": "dpa/s",
    "category": "phase_transformation",
    "source_file": "summaries/2025_Aagesen_PhaseTransformation_Superlattice.md",
    "confidence": "medium",
    "value_type": "scalar",
    "value": 3400,
    "temperature": "1173 K",
    "material": "Mo (BCC)",
    "method": "rate theory analytical model",
    "note": "Consistent with Brimhall & Simonen (1973) experimental observation of nucleation & growth"
  },
  {
    "id": "AAG25-Twindow",
    "name": "Void superlattice formation temperature window",
    "symbol": "T_window",
    "unit": "K",
    "category": "irradiation",
    "source_file": "summaries/2025_Aagesen_PhaseTransformation_Superlattice.md",
    "confidence": "medium",
    "value_type": "expression",
    "value_expr": "0.25*T_m < T < 0.50*T_m",
    "material": "general metals",
    "method": "literature review",
    "note": "Approximate guideline; Sun 2022 review"
  },
  {
    "id": "AAG25-NiE0v",
    "name": "Vacancy migration energy in Ni",
    "symbol": "E_0^v",
    "unit": "eV",
    "category": "diffusion",
    "source_file": "summaries/2025_Aagesen_PhaseTransformation_Superlattice.md",
    "confidence": "medium",
    "value_type": "scalar",
    "value": 1.2,
    "material": "Ni (FCC)",
    "method": "analytical model parameter"
  },
  {
    "id": "AAG25-Niomega",
    "name": "Regular solution parameter for Ni",
    "symbol": "ω",
    "unit": "eV",
    "category": "thermodynamic",
    "source_file": "summaries/2025_Aagesen_PhaseTransformation_Superlattice.md",
    "confidence": "medium",
    "value_type": "scalar",
    "value": 1.39,
    "material": "Ni (FCC)",
    "method": "analytical model parameter"
  }
]